{
  "basics": {
    "name": "Vishal Shaji",
    "title": "Software & Cloud Engineer",
    "email": "vishshaji03@gmail.com",
    "phone": "+91 7306997081",
    "location": "Kochi, India",
    "website": "https://vishalshaji.com",
    "linkedin": "VishalShaji",
    "github": "Vishhh03"
  },
  "work": [
    {
      "company": "Cognizant Technology Solutions",
      "position": "Programmer Analyst - UPS Logistics Services",
      "startDate": "Jul 2025",
      "endDate": "Present",
      "location": "Chennai, India",
      "highlights": [
        "Built and maintained Azure Data Factory production pipelines supporting enterprise data workflows.",
        "Developed internal .NET automation and Dynatrace monitoring tools using REST API and powershell automations.",
        "Sole offshore owner for production support of two business-critical UPS service domains, coordinating directly with onshore teams and clients to resolve incidents and ensure operational continuity."
      ]
    },
    {
      "company": "Bommaku Constructions",
      "position": "Tech Consultant (Intern)",
      "startDate": "Jan 2025",
      "endDate": "Jun 2025",
      "location": "Hyderabad, India",
      "highlights": [
        "Built a marketing AI agent (LangChain + n8n + Sarvam AI) handling 100+ inbound caller inquiries using Telephony.",
        "Developed live cloud-rendered 3D visualizations workflow in Unreal Engine 5, streamed from AWS EC2 for real-time stakeholder presentations."
      ]
    }
  ],
  "projects": [
    {
      "name": "Hybrid-Cloud Game Server SaaS",
      "subtitle": "AetherRuin",
      "website": "https://www.aetherruin.com",
      "github": "https://github.com/Vishhh03/AetherRuin-agent",
      "highlights": [
        "Architected a multi-cloud SaaS platform on AWS, GCP, and Cloudflare Edge Workers/Durable Objects to orchestrate stateful game servers, cutting infrastructure idle costs by 90%.",
        "Engineered an NVMe storage engine with Btrfs incremental snapshots, achieving < 100ms filesystem freeze times and a 60-second Recovery Time Objective (RTO).",
        "Open-sourced a lightweight Go host agent that securely maintains bidirectional WebSocket connections, streams real-time node telemetry, and executes authenticated remote RCON commands."
      ]
    },
    {
      "name": "Serverless Resume Infrastructure",
      "subtitle": "AI-Latex-Editor",
      "github": "https://github.com/Vishhh03/Latex-Resume",
      "highlights": [
        "Provisioned AWS infrastructure via Terraform IaC (ECS Fargate Spot, Lambda, SNS, IAM), reducing monthly cost from $50+ (always-on EC2) to under $1.",
        "Engineered wake-on-demand architecture with 60s cold start and auto-shutdown after 10min idle, cutting compute hours by 95% and auto-disable with SNS+Lambda when infrastructure spend exceeds $5/month.",
        "Integrated Amazon Bedrock (Qwen) for AI-driven LaTeX patching with xelatex compilation and auto-commit to GitHub."
      ]
    }
  ],
  "education": [
    {
      "institution": "TOCH Institute of Science and Technology",
      "area": "Civil Engineering",
      "studyType": "Bachelor of Technology (B.Tech)",
      "startDate": "2021",
      "endDate": "2025",
      "location": "Kochi, India",
      "highlights": [
        "Minor in Machine Learning",
        "Led a final year project focused on Kochi Metro analytics using Machine learning which won Best Paper Award in International Conference (ICITES)."
      ]
    }
  ],
  "skills": [
    {
      "name": "Development",
      "keywords": ["Python", "JavaScript", "Typescript", "Golang", "SQL", "React", "Next.js", "FastAPI", "Node.js", "PostgreSQL", "MongoDB"]
    },
    {
      "name": "AI",
      "keywords": ["MCP", "LLM deployment", "Bedrock", "RAG"]
    },
    {
      "name": "Cloud & Infra",
      "keywords": ["AWS (Lambda, DynamoDB, IAM, EC2, S3, CloudWatch, ECS)", "Cloudflare", "GCP"]
    },
    {
      "name": "DevOps",
      "keywords": ["Linux", "Nginx", "GitHub Actions", "Git", "Bash Scripting", "Prometheus", "Grafana", "Docker", "Kubernetes", "Terraform"]
    }
  ],
  "certifications": [
    "Claude Certified Architect - Professional (4xClaude Certified)",
    "AWS Certified Cloud Practitioner",
    "AWS Certified AI Practitioner",
    "OCI Associate Architect"
  ],
  "openSource": [
    "Contributed 10+ merged pull requests for fixes and tests across freeCodeCamp and OpenSearch"
  ]
}
